{
 "app": "chatgpt",
 "name": "ChatGPT",
 "hosts": [
  "chatgpt.com",
  "chat.openai.com"
 ],
 "theme": "dark",
 "source": "live DOM",
 "captured": {
  "date": "2026-10-09",
  "time_utc": "21:02-21:19 (account lock held 17 min)",
  "url_paths": [
   "/ (new chat, Chat mode)",
   "/c/<id> (existing image chat, read-only)",
   "/c/<id> (existing text chat, read-only)"
  ],
  "theme": "dark (prefers-color-scheme: dark; RULEBOOK S7)",
  "viewport": {
   "css_w": 1536,
   "css_h": 864,
   "device_scale_factor": 1.6667,
   "note": "the recorder's own viewport (agent_rec.mjs CSS_W 1536 captured at 2560x1440); every px in this kit is a CSS px at that viewport"
  },
  "browser": "Google Chrome 155 (aieditor-screencast:0.2, macchrome.mjs Mac identity), logged in as Jake Dawson (Plus)",
  "model_label_seen": "Instant"
 },
 "fonts": {
  "Inter": "Inter.ttf"
 },
 "font_real": "-apple-system-body, ui-sans-serif, -apple-system, system-ui, \"Segoe UI\", Helvetica, \"Apple Color Emoji\", Arial, sans-serif (= SF Pro on a Mac). The capture browser aliases SF to Inter (screencast/image/fonts-mac.conf), so the screenshots ARE Inter; Inter is also the closest free (OFL) match to SF Pro.",
 "tokens": {
  "--cg-page": "#000000",
  "--cg-composer": "rgb(27, 27, 27)",
  "--cg-menu": "rgb(48, 48, 48)",
  "--cg-menu-border": "rgba(255, 255, 255, 0.15)",
  "--cg-hover": "rgba(255, 255, 255, 0.1)",
  "--cg-text": "rgb(237, 237, 237)",
  "--cg-text-2": "rgb(175, 175, 175)",
  "--cg-text-3": "rgb(205, 205, 205)",
  "--cg-accent": "rgb(44, 103, 197)",
  "--cg-pill": "rgb(83, 130, 205)",
  "--cg-user-bubble": "rgb(23, 62, 118)",
  "--cg-user-text": "rgb(246, 250, 254)",
  "--cg-file-ic": "rgb(2, 133, 255)",
  "--cg-shimmer-base": "rgba(175, 175, 175, 0.55)",
  "--cg-shimmer-hi": "rgba(255, 255, 255, 0.75)",
  "--cg-font": "Inter, -apple-system, system-ui, sans-serif"
 },
 "composer": {
  "width": 768,
  "height": 52,
  "height_multiline": 102,
  "height_with_attachments": 246,
  "radius": 26,
  "radius_multiline": 28,
  "multiline_over_px": 520,
  "multiline_rule": "Live: a SETTLED draft with any text is multi-line (text on its own row, + and tools on a second row, height 102) — every screenshot with text showed it, even 'Hi'; WHILE characters were being typed the DOM still reported single-line until the text was wider than the 520 px field. Kit default = single-line (the typing look, stable for motion); set layout_class 'is-multiline' for the settled look (once typing stops, or at once when the prompt is wider than multiline_over_px). A pill or attachment in the draft always switches to multi-line by itself (CSS :has).",
  "placeholder": "Ask ChatGPT",
  "model": "Instant",
  "prompt_sel": ".cg-prompt",
  "send_sel": ".cg-go",
  "plus_sel": ".cg-plus",
  "text_sel": ".cg-text",
  "fill": {
   "prompt": "typed text (escaped)",
   "placeholder": "shown only while prompt is empty",
   "chips_html": "chip.html instances (pill inline before the text; image/file tiles above it)",
   "caret_html": "optional '<span class=\"cg-caret\"></span>' while typing",
   "layout_class": "'' or 'is-multiline'",
   "model": "model label (default 'Instant' — pass composer.model)",
   "state_html": "optional, appended inside the box"
  },
  "css": ".cg-composer{position:relative;box-sizing:border-box;width:768px;font-family:var(--cg-font, Inter, sans-serif);font-size:16px;line-height:24px;font-weight:400;color:var(--cg-text, #ededed);background:var(--cg-composer, #1b1b1b);border-radius:26px;box-shadow:inset 0 0 1px 0 rgba(255,255,255,0.2);-webkit-font-smoothing:antialiased;font-optical-sizing:none}\n.cg-composer svg{display:block;flex:none}\n.cg-grid{display:grid;grid-template-columns:36px minmax(0,1fr) auto;column-gap:8px;align-items:center;padding:8px}\n.cg-plus{grid-column:1;grid-row:1;width:36px;height:36px;box-sizing:border-box;border-radius:9999px;display:flex;align-items:center;justify-content:center;color:var(--cg-text, #ededed)}\n.cg-text{grid-column:2;grid-row:1;min-width:0;margin:5px 0;line-height:26px;min-height:26px;white-space:pre;overflow:hidden;text-overflow:ellipsis;color:var(--cg-text, #ededed)}\n.cg-ph{color:var(--cg-text-2, #afafaf)}\n.cg-prompt:not(:empty)~.cg-ph{display:none}\n.cg-caret{display:inline-block;width:1.5px;height:20px;margin-left:1px;vertical-align:-4px;background:var(--cg-text, #ededed)}\n.cg-tools{grid-column:3;grid-row:1;display:flex;align-items:center;justify-content:flex-end}\n.cg-model{height:36px;box-sizing:border-box;display:flex;align-items:center;gap:6px;padding:0 14px 0 12px;border-radius:18px;line-height:26px;color:var(--cg-text-2, #afafaf);white-space:nowrap}\n.cg-ibtn{width:36px;height:36px;box-sizing:border-box;display:flex;align-items:center;justify-content:center;border-radius:9999px;color:var(--cg-text, #ededed)}\n.cg-go{width:36px;height:36px;margin-left:8px;box-sizing:border-box;display:flex;align-items:center;justify-content:center;border-radius:9999px;background:var(--cg-accent, #2c67c5);color:#fff}\n.cg-send{display:none}\n.cg-composer:has(.cg-prompt:not(:empty)) .cg-voice,.cg-composer:has(.cg-chip) .cg-voice{display:none}\n.cg-composer:has(.cg-prompt:not(:empty)) .cg-send,.cg-composer:has(.cg-chip) .cg-send{display:flex}\n/* multi-line layout: see composer.multiline_rule */\n.cg-composer.is-multiline,.cg-composer:has(.cg-chip){border-radius:28px}\n.cg-composer.is-multiline .cg-grid,.cg-composer:has(.cg-chip) .cg-grid{grid-template-rows:auto 36px;column-gap:5px;padding:0 8px;margin-bottom:9px}\n.cg-composer.is-multiline .cg-text,.cg-composer:has(.cg-chip) .cg-text{grid-column:1/-1;grid-row:1;margin:0 -8px;padding:15px 18px 16px;white-space:pre-wrap;overflow:visible;max-height:216px}\n.cg-composer.is-multiline .cg-plus,.cg-composer:has(.cg-chip) .cg-plus{grid-row:2}\n.cg-composer.is-multiline .cg-tools,.cg-composer:has(.cg-chip) .cg-tools{grid-row:2}",
  "html": "<div class=\"cg-composer {{layout_class}}\"><div class=\"cg-grid\"><div class=\"cg-plus\">{{file:assets/plus.svg}}</div><div class=\"cg-text\">{{chips_html}}<span class=\"cg-prompt\">{{prompt}}</span><span class=\"cg-ph\">{{placeholder}}</span>{{caret_html}}</div><div class=\"cg-tools\"><div class=\"cg-model\"><span>{{model}}</span>{{file:assets/chevron-down.svg}}</div><div class=\"cg-ibtn\">{{file:assets/mic.svg}}</div><div class=\"cg-go cg-voice\">{{file:assets/voice.svg}}</div><div class=\"cg-go cg-send\">{{file:assets/send-arrow.svg}}</div></div></div>{{state_html}}</div>"
 },
 "menu": {
  "anchor": "below",
  "gap": 4,
  "offset_x": 0,
  "row_h": 36,
  "width": 768,
  "max_visible_rows": 10,
  "anchor_note": "on the empty new-chat screen the composer sits mid-page and the '+' menu opens BELOW it (4 px gap, same 768 width, left edges aligned). In a thread the composer is at the bottom of the page and the menu opens above it — that variant was NOT captured.",
  "hover_class": "cg-hover",
  "first_row_highlighted": true,
  "css": ".cg-menu{box-sizing:border-box;width:768px;max-height:378px;overflow:hidden;display:flex;flex-direction:column;padding:8px;background:var(--cg-menu, #303030);border:1px solid var(--cg-menu-border, rgba(255,255,255,0.15));border-radius:20px;font-family:var(--cg-font, Inter, sans-serif);font-size:14px;line-height:20px;font-weight:400;color:var(--cg-text, #ededed);-webkit-font-smoothing:antialiased;font-optical-sizing:none}\n.cg-item{box-sizing:border-box;flex:none;display:flex;align-items:center;gap:12px;min-height:36px;padding:6px 8px;border-radius:12px;overflow:hidden;white-space:nowrap}\n.cg-item.cg-hover{background:var(--cg-hover, rgba(255,255,255,0.1))}\n.cg-item-ic{width:20px;height:20px;flex:none;display:flex;align-items:center;justify-content:center}\n.cg-item-ic svg{display:block;width:20px;height:20px}\n.cg-app-ic{display:block;width:16px;height:16px;border-radius:2px;object-fit:contain}\n.cg-item-tx{min-width:0;flex:1;display:flex;align-items:center;gap:12px;overflow:hidden}\n.cg-item-label{flex:none}\n.cg-item-desc{min-width:0;color:var(--cg-text-2, #afafaf);overflow:hidden;text-overflow:ellipsis}",
  "html": "<div class=\"cg-menu\">{{items_html}}</div>",
  "item_html": "<div class=\"cg-item\"><span class=\"cg-item-ic\">{{icon_html}}</span><span class=\"cg-item-tx\"><span class=\"cg-item-label\">{{label}}</span><span class=\"cg-item-desc\">{{desc}}</span></span></div>",
  "items": [
   {
    "label": "Add photos & files",
    "desc": "Upload from computer",
    "icon": "assets/menu-add-photos-files.svg"
   },
   {
    "label": "Add from library",
    "desc": "Browse and search your files",
    "icon": "assets/menu-add-from-library.svg"
   },
   {
    "label": "Create image",
    "desc": "Visualize anything",
    "icon": "assets/menu-create-image.svg"
   },
   {
    "label": "Web search",
    "desc": "Find real-time news and info",
    "icon": "assets/menu-web-search.svg"
   },
   {
    "label": "Deep research",
    "desc": "Get a detailed report",